{
  "$schema": "../../estudio/esquemas/musica.schema.json",
  "version": 1,
  "nota": "Temas e instrumentos de la pestaña Música del Estudio. Un tema con la clave de uno del código lo reemplaza; con borrador: true el juego no lo usa.",
  "instrumentos": {
    "campana": {
      "nombre": { "es": "Campana", "en": "Bell" },
      "onda": "sine",
      "ataque": 0.002,
      "caida": 1.2,
      "largo": 0,
      "vol": 0.8,
      "armonicos": [
        { "onda": "sine", "ratio": 2.76, "vol": 0.25 },
        { "onda": "sine", "ratio": 5.4, "vol": 0.1 }
      ]
    },
    "guitarraSkank": {
      "nombre": { "es": "Guitarra skank", "en": "Skank guitar" },
      "nota": "Guitarra limpia y corta de Salonas para el contratiempo del ska.",
      "onda": "square",
      "ataque": 0.002,
      "caida": 0.08,
      "largo": 0.15,
      "vol": 0.5,
      "voces": 2,
      "desafino": 9,
      "filtro": { "tipo": "bandpass", "frec": 1900, "q": 1.1 }
    },
    "metales": {
      "nombre": { "es": "Metales", "en": "Horns" },
      "nota": "Trompeta y saxo juntos (sección de vientos del ska).",
      "onda": "sawtooth",
      "ataque": 0.025,
      "caida": 0.12,
      "largo": 0.85,
      "vol": 0.32,
      "voces": 2,
      "desafino": 14,
      "filtro": { "tipo": "lowpass", "frec": 2600, "q": 0.8 },
      "vibrato": { "frec": 5.5, "cents": 12 }
    },
    "guitarraSucia": {
      "nombre": { "es": "Guitarra sucia", "en": "Dirty guitar" },
      "nota": "Guitarra saturada de garage (acordes de quinta).",
      "onda": "sawtooth",
      "ataque": 0.003,
      "caida": 0.18,
      "largo": 0.9,
      "vol": 0.34,
      "voces": 3,
      "desafino": 16,
      "filtro": { "tipo": "lowpass", "frec": 2300, "q": 1.6 }
    },
    "acordeon": {
      "nombre": { "es": "Acordeón", "en": "Accordion" },
      "nota": "Acordeón de la cumbia chilena: dos lengüetas un poco desafinadas (musette) y un vibrato suave.",
      "onda": "sawtooth",
      "ataque": 0.03,
      "caida": 0.1,
      "largo": 0.9,
      "vol": 0.28,
      "voces": 2,
      "desafino": 12,
      "filtro": { "tipo": "lowpass", "frec": 2200, "q": 0.9 },
      "vibrato": { "frec": 6, "cents": 9 }
    },
    "guiro": {
      "nombre": { "es": "Güiro", "en": "Guiro" },
      "nota": "El raspado de la cumbia (ruido agudo y corto).",
      "onda": "ruido",
      "ataque": 0.004,
      "caida": 0.045,
      "largo": 0,
      "vol": 0.5,
      "filtro": { "tipo": "highpass", "frec": 3800, "q": 0.8 }
    },
    "cencerro": {
      "nombre": { "es": "Cencerro", "en": "Cowbell" },
      "nota": "Cencerro de la cumbia: dos tonos metálicos cortos.",
      "onda": "square",
      "ataque": 0.001,
      "caida": 0.07,
      "largo": 0,
      "vol": 0.35,
      "golpe": 73,
      "filtro": { "tipo": "bandpass", "frec": 900, "q": 2.5 },
      "armonicos": [
        { "onda": "square", "ratio": 1.5, "vol": 0.6 }
      ]
    },
    "conga": {
      "nombre": { "es": "Conga", "en": "Conga" },
      "nota": "Tumbao de conga (golpe de cuero grave).",
      "onda": "sine",
      "ataque": 0.002,
      "caida": 0.16,
      "largo": 0,
      "vol": 0.7,
      "golpe": 55,
      "armonicos": [
        { "onda": "sine", "ratio": 1.6, "vol": 0.2 }
      ]
    },
    "guitarraFunk": {
      "nombre": { "es": "Guitarra funk", "en": "Funk guitar" },
      "nota": "Rasguido corto y apagado del funk (casi un clavinet).",
      "onda": "square",
      "ataque": 0.002,
      "caida": 0.05,
      "largo": 0.08,
      "vol": 0.4,
      "voces": 2,
      "desafino": 7,
      "filtro": { "tipo": "bandpass", "frec": 2300, "q": 1.6 }
    },
    "cuerdas": {
      "nombre": { "es": "Cuerdas disco", "en": "Disco strings" },
      "nota": "Colchón de violines del disco (entra lento y queda).",
      "onda": "sawtooth",
      "ataque": 0.18,
      "caida": 0.3,
      "largo": 1,
      "vol": 0.2,
      "voces": 3,
      "desafino": 18,
      "filtro": { "tipo": "lowpass", "frec": 3200, "q": 0.7 },
      "vibrato": { "frec": 5, "cents": 8 }
    },
    "guitarraSolo": {
      "nombre": { "es": "Guitarra solista", "en": "Lead guitar" },
      "nota": "La guitarra de Salonas para los solos: saturada, con vibrato.",
      "onda": "sawtooth",
      "ataque": 0.004,
      "caida": 0.2,
      "largo": 0.85,
      "vol": 0.3,
      "voces": 2,
      "desafino": 6,
      "filtro": { "tipo": "lowpass", "frec": 3400, "q": 2 },
      "vibrato": { "frec": 6.5, "cents": 18 }
    },
    "guitarraMetal": {
      "nombre": { "es": "Guitarra metal", "en": "Metal guitar" },
      "nota": "Quintas apagadas del thrash (palm mute).",
      "onda": "sawtooth",
      "ataque": 0.002,
      "caida": 0.09,
      "largo": 0.4,
      "vol": 0.32,
      "voces": 3,
      "desafino": 14,
      "filtro": { "tipo": "lowpass", "frec": 1500, "q": 2.4 }
    }
  },
  "temas": {
    "ejemplo": {
      "nombre": { "es": "Ejemplo", "en": "Example" },
      "borrador": true,
      "uso": "libre",
      "bpm": 100,
      "pasos": 16,
      "vol": 0.09,
      "prog": ["C", "Am", "F", "G"],
      "capas": [
        {
          "nombre": "bajo",
          "inst": "bajo",
          "rel": [0, null, null, null, 7, null, null, null, 0, null, null, null, 7, null, 12, null],
          "octava": -12,
          "dur": 2,
          "vol": 0.45
        },
        { "nombre": "bombo", "inst": "kick", "ritmo": "x.......x.......", "vol": 0.6 },
        { "nombre": "caja", "inst": "caja", "ritmo": "....x.......x...", "vol": 0.3 },
        {
          "nombre": "campana",
          "inst": "campana",
          "arpegio": [0, null, 1, null, 2, null, 1, null],
          "octava": 24,
          "dur": 1,
          "vol": 0.25
        }
      ]
    }
  },
  "canciones": {
    "pescador": {
      "nombre": { "es": "Pescador de sapos", "en": "Toad Fisher" },
      "nota": "Ejemplo del formato (el riff de mundo/criaturas/bajo.js con secciones). Las 6 canciones de la gira van después.",
      "borrador": true,
      "bpm": 100,
      "pasos": 16,
      "vol": 0.1,
      "prog": ["E"],
      "estructura": [
        { "seccion": "intro", "compases": 2 },
        { "seccion": "verso", "compases": 4 },
        { "seccion": "coro", "compases": 4 },
        { "seccion": "verso", "compases": 4 },
        { "seccion": "coro", "compases": 4 },
        { "seccion": "final", "compases": 1 }
      ],
      "capas": [
        {
          "nombre": "bajo",
          "inst": "bajoSlap",
          "vol": 1,
          "compases": 2,
          "niveles": ["intro", "verso"],
          "bajo": [
            [0, "s", 28, 1],
            [1, "g", 28, 1],
            [2, "p", 40, 1],
            [3, "g", 28, 1],
            [4, "s", 28, 1],
            [6, "s", 29, 1],
            [7, "p", 41, 1],
            [8, "s", 28, 2],
            [10, "r", 28, 2, [28, 35, 40, 43]],
            [12, "s", 23, 2],
            [14, "p", 35, 1],
            [15, "s", 24, 1],
            [16, "s", 28, 1],
            [18, "p", 43, 1],
            [19, "p", 42, 1],
            [20, "s", 28, 2],
            [22, "a", 52, 4],
            [26, "d", 40, 4, 28],
            [30, "r", 28, 1, [28, 35, 40]],
            [31, "g", 28, 1]
          ]
        },
        {
          "nombre": "bajo (coro)",
          "inst": "bajoSlap",
          "vol": 1,
          "compases": 2,
          "niveles": ["coro"],
          "bajo": [
            [0, "s", 28, 1],
            [1, "g", 28, 1],
            [2, "p", 40, 1],
            [3, "g", 28, 1],
            [4, "s", 31, 1],
            [5, "p", 43, 1],
            [6, "s", 32, 1],
            [7, "p", 44, 1],
            [8, "s", 33, 2],
            [10, "r", 33, 2, [33, 40, 45, 48]],
            [12, "s", 23, 2],
            [14, "p", 35, 1],
            [15, "s", 24, 1],
            [16, "s", 28, 1],
            [17, "g", 28, 1],
            [18, "p", 40, 1],
            [19, "p", 39, 1],
            [20, "p", 38, 1],
            [21, "p", 37, 1],
            [22, "s", 28, 2],
            [24, "d", 28, 6, 52],
            [30, "p", 52, 1],
            [31, "g", 28, 1]
          ]
        },
        {
          "nombre": "bajo (final)",
          "inst": "bajoSlap",
          "vol": 1,
          "niveles": ["final"],
          "bajo": [
            [0, "r", 28, 8, [28, 35, 40, 43]]
          ]
        },
        {
          "nombre": "bombo",
          "inst": "kick",
          "ritmo": "x..x....x..x....x..x....x.......x..x....x..x....x..x....x.......",
          "vol": 0.7,
          "niveles": ["verso", "coro"]
        },
        {
          "nombre": "caja",
          "inst": "caja",
          "ritmo": "....x.......x...",
          "vol": 0.35,
          "niveles": ["verso", "coro"]
        },
        {
          "nombre": "charles",
          "inst": "hat",
          "ritmo": "x.x.x.x.x.x.x.x.",
          "vol": 0.25,
          "niveles": ["intro", "verso", "coro"]
        },
        {
          "nombre": "platillo",
          "inst": "platillo",
          "ritmo": "x...............................................................",
          "vol": 0.3,
          "niveles": ["coro", "final"]
        }
      ]
    },
    "sala-ska": {
      "nombre": { "es": "Sábado de Ensayo", "en": "Rehearsal Saturday" },
      "nota": "Canción 1 de la gira (sala de ensayo): reggae que se vuelve ska en el coro. Enseña notas simples a tiempo y el contratiempo.",
      "bpm": 90,
      "pasos": 16,
      "vol": 0.1,
      "swing": 0.12,
      "prog": ["Am", "D"],
      "progs": {
        "intro": ["Am", "D"],
        "verso": ["Am", "D"],
        "precoro": ["Dm", "Em", "F", "G"],
        "coro": ["F", "C", "G", "Am"],
        "final": ["Am"]
      },
      "vozBajo": {
        "vol": 0.6,
        "saturacion": 1.3,
        "nasal": { "frec": 700, "q": 1.2, "ganancia": 4 },
        "tecnicas": {
          "t": { "onda": "triangle", "brillo": 950, "q": 2, "ataque": 0.004, "vol": 0.62, "cola": 0.16 }
        }
      },
      "estructura": [
        { "seccion": "intro", "compases": 2 },